{
  "record_kind": "qualification",
  "schema_version": 1,
  "record_context": "fixture",
  "record_id": "fixture.qualification",
  "disclosure": {
    "mode": "full",
    "withheld": [],
    "origin_token": null
  },
  "runs": [
    {
      "ref_type": "record",
      "path": "records/run.json",
      "record_kind": "run",
      "schema_version": 1,
      "digest": {
        "algorithm": "sha256",
        "scope": "exact_utf8_file_bytes",
        "value": "2196fefe859609e30200205e5c75e4814628d4287fe3e4a8f99b8f01cc8cc615"
      }
    }
  ],
  "decision": "supported",
  "reviewer": "fixture-reviewer",
  "required_checks": [
    "fixture-check"
  ],
  "configuration": {
    "host": {
      "os": "macos",
      "architecture": "arm64",
      "version": [
        26,
        0,
        0
      ],
      "capabilities": [
        "fixture-capability"
      ]
    },
    "chip": "synthetic-arm64",
    "game_build": "fixture-game",
    "steam_build": "fixture-steam",
    "renderer": "fixture-renderer",
    "translator": "fixture-translator"
  },
  "scope": "development",
  "reviewed_at": "2026-09-28T09:27:08Z",
  "test_revision": "fixture-test-v1",
  "limitations": []
}
